Project ID,Year,Year Project Number,Project Name,Document Link,Legitimacy,Website Link,Country,Topic Area,Notes,Full Abstract,Rank,Tech-Solution,,,,,,,,,,,,,,,,
2016-10,2016,10,"Reinventing Global Payment Processing for Migrant Remittances, Microenterprise Funding Infusions and Nationwide Direct Benefit Transfers (DBTs)",,,,,"Remittances,
Global Payments",,"Centralized financial systems have formed the core of international finance for decades. The obvious advantage is that a financial institution acting as counterparty adds trust, and the provision of a singular, institutionally held transaction “ledger” obviates the need for third-party authentication. However, this centralization has added costs that are passed on to end-us- ers: our proposal is an attempt to look at the value that can be added by switching to a decentralized payment processing system that can be cur- rency-neutral, scalable, robust, and built on top of a system of publicly ver- ifiable transactions. In order to understand the actual impact that such technology can provide, we look at the benefits of implementing this sys- tem for international remittances by migrants, Direct Benefit Transfers, and national subsidy schemes, and in the funding of grassroots projects by international donors.
Contextually, staggering losses—as high as 50 percent—are observed in end-to-end transmission for aid programs. Broadly, there are three sys- temic causes:
1.        Systemic corruption enabled by layered centralization;
2.        Consolidation of control/access by middlemen, and distinct informa- tion asymmetry; and
3.        Inefficiencies of transmission systems for smaller trade quanta.
The suggested implementation looks at Blockchain technology—the backbone of cryptocurrencies1 such as Bitcoin, Dogecoin and Ethereum. The efficiency offered by this technology, together with its fully traceable nature presents a unique opportunity to tackle systemic corruption, distri- bution failures, and the onerous fees levied by monopolistic payment pro- cessors. This implementation is not seen presently in a holistic form, but is built up of individual components that are well established and whose effi- cacy has been verified empirically on a local and global scale.
Beyond our proposal, the exact technical decisions will need to be explored further. Options include “forking,” which is building a custom copy of an existing cryptocurrency protocol, or building upon existing freeform systems such as Ethereum that allow programming smart con- tracts directly into the software. Since the recommendations in the pro- posal could essentially be assembled on top of existing and available platforms, the feasibility of the project is considerably high.
Given the nature of the gains made by this proposed system, it is observed that the most potential is for developing nations that often bear the brunt of institutional financial inefficiencies.
Considering the novelty of the technology discussed here, a few signifi- cant challenges pose themselves: low market depth for individual crypto- currencies mean high volatility; lack of oversight is seen as inherently threatening by global governments, who also drag their feet when it comes to unexpected jumps in technologies with far-reaching consequences.
",NA - Honourable mention,,,,,,,,,,,,,,,,,
2017-1,2017,1,Creating Kitovu: A Web/Mobile- Based Decentralized Fertilizer and Seedling Warehousing System That Increases Crop Yields in Nigeria by Matching the Right Inputs to the Right Soils,,,,Nigeria,"Agriculture,
Warehousing",,"Most of the world’s poorest people are smallholder farmers. At least 570 million farms worldwide are smallholdings, with more than 475 million of those farms owned by families who cultivate less than two hectares of land. In Nigeria, 70 percent of the working population, or about 121 million people, are farmers. In Sub-Saharan Africa as a whole, agriculture accounts for 64 percent of the labor force and 75 percent of the people who survive on less than $1 per day work in the agricultural sector. This level of poverty results primarily from very low yields, compared with global yield aver- ages, as well as from very high postharvest losses. Annual postharvest losses range between 40 percent and 60 percent, depending on the value chain being considered. After years of trying to find solutions to low crop yields, we formed the Kitovu Technology Company and developed the Kitovu platform. The Kitovu team consists of a passionate group of young people who have experience in agriculture, processing, and consultancy services within the African agricultural value chain.
The Kitovu team firmly believes that improving the use of inputs by farmers has the potential to lift millions of smallholder farmers out of pov- erty. But for that to be feasible, a system must be in place that matches the right composition and quantity of fertilizers, good quality or improved seeds, and other inputs to farms’ actual soils and sites. These practices would improve yields and consequently increase farmers’ incomes.
This report describes how the Kitovu platform solves the problem of low yields and explains the platform’s estimated effects on poverty and social well-being.
",1,Yes - Web/Mobile,,,,,,,,,,,,,,,,
2017-2,2017,2,"Reducing Breast Cancer Death Rates among Women in Uganda and Increasing the Employability of Visually Impaired Women
",,,,Uganda,"Healthcare,
Employment",,"The Gifted Hands Network turns problems into opportunities by training women who are visually impaired to conduct breast cancer examinations. As a result, women with breast cancer are more likely to receive treatment in time for full recovery, and women who are blind gain employment and social standing.
Uganda is a developing country with a population of approximately 42 million people. More than 56 percent of the population is female, and more than 85 percent live without access to good health facilities. This situation has led to significant loss of life. Good health care is needed in Uganda, but health services are very expensive and few people can afford them.
Uganda is among the African countries most affected by breast cancer. Breast cancer has increased drastically over the past 10 years. The Breast Cancer Working Group report from Makerere Medical School states that more than 30,000 women have breast cancer and more than 2,500 women die from the disease annually in the country. Dr. Fred Okuku, a medical oncologist at Mulago Hospital in Uganda, said in his medical report of 2014 that there is an additional unknown number of women dying from undiagnosed breast cancer.
 
Uganda has more than 1.6 million people who are blind. Socially, people who are blind are looked on as misfits, nonproductive people, and depen- dents. They are discriminated against and marginalized in society. More than 99.5 percent of them are not employed even though many have received rehabilitation and some are university graduates. These individu- als have a genius sense of touch that would enable them to detect breast cancer early once they have received medical training.
",2,,,,,,,,,,,,,,,,,
2017-3,2017,3,"Converting Unproductive, Waterlogged Land into Productive Fish Farming Units to Generate Sustainable Livelihoods, Provide Food Security, and Develop Critical Avenues for Economic Growth for Local Rural Communities",,,,India,"Fish Farming,
Economic Growth",,"Bihar, India, has more than 9,000 square kilometers of low-lying, water- logged wasteland. It has a population of about 130 million, 80 percent of whom are below the poverty line of US$1 a day. Of those, 15 million people belong to the fisher community, all of whom live below the poverty line and are classified by the government as an extremely backward caste. Fish is the staple diet in the region, with annual  consumption  of  fish  at US$1 billion, but Bihar suffers from a gap between demand and supply of more than 232 million kilograms of fish per year (US$390 million). To fulfill that unmet demand, Bihar is importing fish from neighboring states through unorganized channels.
Agratam India works in the state of Bihar to convert low-lying and unproductive wastelands into productive fish farming units. The project primarily aims to provide sustainable employment opportunities to the members of the extremely poor fisher community, who do not have access to a consistent and stable source of income. By aggregating the unproduc- tive parcels of land held by smallholder farmers, Agratam also provides these farmers with rental income on land from which they otherwise extract negligible value or economic returns.
Agratam’s aim is to use existing natural resources in an economically productive and sustainable manner to create income-generating opportu- nities for the poorest sections of the community.1 The holistic model focuses on converting unproductive land mass into profit-generating assets, thereby creating employment, stabilizing incomes, developing skills, and addressing food security and malnutrition, all of which contribute to the sustainable development of underserved rural communities.
",3,,,,,,,,,,,,,,,,,
2017-4,2017,4,"Encouraging Volunteerism Using a Proprietary Digital-Currency Incentive
",,,,US,"Volunterism,
Digital currency",,"Project Forward is an innovative, self-sustaining, and social currency– backed ecosystem that allows not-for-profit organizations to indirectly incentivize volunteers. At its core, Project Forward facilitates the moneti- zation of volunteer hours through a proprietary digital currency.
Within the United States alone, there is a stark drop-off in the rates of volunteerism. In the past 12 years volunteer rates fell from 28.8 percent in 2003 to 24.9 percent in 2015 (U.S. Bureau of Labor Statistics 2003; U.S. Bureau of Labor Statistics 2016). While there are several theories as to why the rate of volunteerism is declining, it is clear that not-for-profit organiza- tions are having less success encouraging people to engage and become more active in their communities. To cultivate meaningful and long lasting engagement, organizations that rely on volunteers must entertain the thought of creating a more comprehensive incentive.
The use of digital currencies continues to increase. Technology has cre- ated the next wave of transactional components that banks and individuals alike have begun to adopt: a new medium of exchange involving digital wallets and smart contracts. To expand this usage and create something that will yield a better value structure, Project Forward has married two vitally beneficial functions. Millennials especially will now be able to obtain the skills required to conduct business in this new era of technology while also giving back. What was once considered an elusive part of the technol- ogy world will instead aid the future of positive social impact.
",4,,,,,,,,,,,,,,,,,
2017-5,2017,5,Portable Toilet Solution: Sustainable Sanitation for the Base of the Pyramid,,,,Philiippines,Toilets,,"Sanitation means more than just the improvement of health and well-being of people. It is an avenue that uplifts human dignity. Given its importance, sanitation should be available and accessible to all; no one should lack proper sanitation. An elixir to the many challenges the world is facing, sanitation is a right and a responsibility of all.
Most Filipinos who belong to the base of the pyramid (BoP) openly defecate in the fields, bushes, and seashores, which poses a wide range of risks to human health and the environment. To help those low-income communities gain access to proper sanitation, Team SAVE proposes to provide them with portable sanitation units. The Portable Toilet Solution (PTS), which is based on a utility business model, depends on two levels of cross-subsidies: (a) between the water supply and sanitation services and (b) across customer classes, to make the system available and afford- able for all.
To ensure sustainability of the program and address the lack of aware- ness about the importance of sanitation, the program must be a collabora- tion between the public and private sectors and should involve the target communities.
The proposal will be piloted in the province of Laguna. The program’s implementation will benefit from the existing public-private partnership between the provincial government of Laguna and Laguna Water, a water and wastewater service provider. The program can then be replicated and scaled up elsewhere in the Philippines and in other developing countries.
",5,,,,,,,,,,,,,,,,,
2017-6,2017,6,A Socio-productive Model for Entrepreneurial Education and the Promotion of Business Activity for Women Who Are Victims of Armed Conflict,,,,Colombia,Women Empoerment,,"The nonprofit foundation She-Is empowers women by recognizing their peace entrepreneurship and acknowledging their very essence as entrepre- neurs. She-Is strengthens productive units through its social brand that promotes the efforts, worth, and representation of women who have been directly affected by armed conflict and who face challenging life situations as a result of the violence they have endured.
She-Is implements a socio-productive model of entrepreneurial educa- tion and promotes business activity for women who are survivors of armed conflict. In Colombia, the She-Is foundation and its campaign is the first of its kind, with a social brand that seeks to champion women in postconflict situations as successful entrepreneurs by harnessing women’s knowledge to positively impact the peace process. This innovative model harmonizes the social brand with an approach that emphasizes soft skills and company start-ups. This model also establishes a pattern for meeting sustainable development goals through economic empowerment.
",6,,,,,,,,,,,,,,,,,
2017-7,2017,7,Commodity Bonds: A Practical Solution to Crisis Vulnerability in Commodity- Dependent Developing Countries,,,,,Bonds,,"Over two-thirds of developing countries’ economies are highly dependent on commodities. These Commodity Dependent Developing Countries (CDDCs) face lower long-term growth prospects and higher risks of enter- ing and remaining in international debt crises. Commodity bonds—bond contracts with coupon payments linked to the price of a country’s main commodity export—are an efficient way of promoting crisis resilience in CDDCs. The idea of commodity bonds is not new. However, commodity bond markets never achieved enough scale to become a viable option for CDDCs.
Here we review past experience, identify barriers to adoption, and pro- pose a novel arrangement to overcome these challenges. In our solution, the World Bank plays an important role in disentangling sovereign risk from commodity risk, making the commodity bond market more attrac- tive to both debt issuing countries and private sector lenders. We illustrate the proposal with an application to Mongolia—a country with over 40 per- cent of export revenue from copper alone. Finally, we present a practical implementation plan to create a large, liquid commodity bond market that would present a new option for CDDCs to increase economic resilience and enhance long-term growth.
",NA - Honourable mention,,,,,,,,,,,,,,,,,
2017-8,2017,8,Filling the Credit Gap: Improving SME Accounting Standards and Data Collection in India,,,,,,,"The growth of small and medium-sized enterprises (SMEs) is critical to the overall economic growth of developing nations. However, many businesses in developing economies do not have sufficient access to the financing they need—they often lack both the financial data and the collateral necessary to acquire loans. Alternative lending, which takes advantage of nontradi- tional data sources, has the potential to mitigate this issue. However, surveys of alternative lenders suggest that a lack of proper accounting data currently hinders the ability of SMEs to obtain financing from these lend- ers. Consequently, alternative lending has yet to make a meaningful dent in the current SME credit gap.
To address this issue, the DataRISE team proposes a comprehensive, dual-platform solution available to both SMEs and alternative lenders. This system would take advantage of existing digital payment infrastructure to greatly improve accounting practices for SMEs and make these data readily available to alternative lenders, thereby reducing customer acquisition costs and enabling greater scale. By better connecting previously excluded businesses to lenders, our platform has the potential to boost SME growth in developing nations around the world. Currently, recent developments and economic conditions in India make the country an optimal environ- ment to implement our solution. Eventually, this service can expand to other emerging markets.
",NA - Honourable mention,,,,,,,,,,,,,,,,,
2017-9,2017,9,Innovative Solutions to a Sustainable Blood Supply Chain Management System: A Technology-Driven Donor Management System in Nigeria,,,,Nigeria,"Supplychain,
Healthcare",,"The use of blood and blood products has become an integral part of mod- ern medical practice globally, with about 108 million pints of blood uti- lized per annum. Every country needs a regular and safe mechanism for the supply of blood. A World Health Organization World Blood Donor Day Report in 2013 stated that in low-income countries, there is a huge demand for blood transfusion, mostly occasioned by complications in pregnancy or in children under age five who suffer from anemia.
Haima Health Initiative (HHI) is deploying mobile and web technology to build a sustainable blood supply chain system in Nigeria, hence mobiliz- ing efforts toward meeting Nigeria’s annual blood requirement of 1.4–1.7 million pints. Currently, Nigeria faces a 62 percent deficit in needed blood supplies.
This project has developed a digital blood bank with an online database of viable, voluntary, unremunerated blood donors who are connected to patients in times of emergency. It provides an excellent opportunity for scale, health sustainability, economic advancement, and public sector and private sector collaboration.
",NA - Honourable mention,,,,,,,,,,,,,,,,,
2017-10,2017,10,"Wicked Problems, Simple Solutions, and a New Generation of Changemakers",,,,,Skills,"- This idea explores the development of a symbiotic relationship between communities and universities to aid in achieving the sustainable develop- ment goals.
- We propose that universities adopt local communities as study areas for their students’ final-year projects.
- This sounds very similiar to the skills gap idea for Skills Nigeria.","Achieving the United Nations’ sustainable development goals is a mam- moth task that requires cooperation among different disciplines, struc- tured classical solutions, and new out-of-the-box approaches. In addition to setting up new organizations to meet set targets, changemakers must reorganize existing systems by identifying elements that can work together to benefit the multiple stakeholders involved. Our proposed framework aims to improve the chances of achieving the sustainable development goals by adding more helping hands to the fight while, in the process, train- ing an entire generation of future changemakers.
This idea explores the development of a symbiotic relationship between communities and universities to aid in achieving the sustainable develop- ment goals. We propose that universities adopt local communities as study areas for their students’ final-year projects. The sustainable development goals will guide the definition of the project objectives. Local communities will serve as multifaceted, cross-disciplinary case studies and benefit from the completed projects. The educated, young, and ambitious students will obtain the chance to experience real-world problems, and the university will gain local expertise and data sets that enable further sophisticated problem solving. The data collected during the course of these projects will enable efficiency measurement, performance quantification, and priority identification. This, in turn, will aid in the reassessment of objectives and will facilitate improvement in the effectiveness of funding allocation.
The feasibility and scalability of the idea are explored in more detail in the proposal. Discussions include the stakeholder management frame- work, scale-up strategy, incentivization program for private investors, a funding strategy, and means to address potential “soft” problems that may surface during the implementation.
",NA - Honourable mention,,,,,,,,,,,,,,,,,
2018-1,2018,1,"The Implementation of Advanced Water Treatment Technology in Aquaculture to Ensure Sustainable Development for World Food Security
",,,,,"Agriculture,
Food security",,"Two-thirds of the people in Asia are undernourished, according to World Food Programme (WFP 2015). The Association of Southeast Asian Nations (ASEAN), a major contributor to aquaculture and to the produc- tion of fish, has a large role in addressing food security and malnutrition in the region. To address these issues, ASEAN has set a goal to increase the supply of farmed ?sh produced in the region from the current 10 million tons to more than 15 million tons by 2030. The current challenges the fish farming industry faces in meeting this goal include the availabil- ity of land for fisheries and the availability of fresh water. With these chal- lenges in mind, we developed MINO Microbubble Technology, an advanced water treatment technology that increases the amount of dis- solved oxygen in water by up to 7 parts per million (ppm). Fish farmers using this technology have up to a 40 percent increase in ?sh yield. We think the MINO Microbubble Technology will help ASEAN attain the goal of 15 million tons of farmed ?sh by 2030 (See figure 1.1). In doing so, ASEAN could meet the United Nations Sustainable Development Goals (SDGs) to end hunger and achieve food security.",1,,,,,,,,,,,,,,,,,
2018-2,2018,2,"Starlight: A Start-Up Company Based in Rwanda That Aims to End the Use of Kerosene Lamps in Rural Villages by Providing Solar-Powered Lanterns to These Communities and by Rolling Out a STEM Program That Empowers Female Students
",,,,Rwanda,"Women Empoerment,
STEM,
Solar",,"Rwanda’s population has more than doubled over the past decade and is expected to reach 16 million by 2032 (National Institute of Statistics of Rwanda 2017). This population growth means that more people will need access to affordable energy to light their homes and streets, to use phones and computers, and to conduct business. At issue is how that energy should be produced—fossil fuels and greenhouse gas emissions are making dras- tic changes in the climate, leading to big problems.
Government data show that Rwanda’s national electrification rate has reached 41 percent (11 percent off-grid, 30 percent on-grid). Over 7 million people still lack access to electricity. The government is targeting 100 per- cent electricity access by 2024. To reach this target, off-grid solutions will be used in remote areas, far from the on-grid network. (Rwanda Development Board 2018). According to the Economic Development and Poverty Reduction Strategy II (EDPRS2), the government was targeting 70 percent rural households with access to electricity (MINECOFIN 2013). (The government has not met this goal).
We believe solar energy is the way to provide greater access to affordable, clean energy. And Rwanda must harness the power of its youth (68.7 per- cent of the country’s population was below the age of 30 in 2015) to figure out how to increase access to this energy (National Institute of Statistics of Rwanda 2017). As a social enterprise, Starlight started a STEM initiative in high schools to encourage students to explore circuitry and to develop technical skills, with the hope to empower Rwanda’s youth (and especially young women) to become a part of the solution.
Our STEM program and our products play a big role in the eradication of poverty through advancements in health, education, industrialization, and combating climate change. The Starlight team’s mission is to empower people by providing them access to light.
This report describes how Starlight can ensure access to affordable energy in rural villages and how Starlight’s initiative can empower Rwanda’s youth to make change happen.
",2,,,,,,,,,,,,,,,,,
